{
  "fixture_id": "VF-3",
  "version": "1.0",
  "job_type": "PRODUCT_OBJECT_VISUAL",
  "is_fixture": true,
  "provenance": "synthetic_fixture",
  "source_ref": {
    "angle_id": null,
    "product_id": "PROD-VQ3",
    "transformation_id": null
  },
  "visual_grounding": {
    "id": "VG-VQ3-001",
    "class": "visual_grounding",
    "scene": "The product object presented on a neutral surface",
    "environment": "Neutral studio surface",
    "subject": "The product (object)",
    "gesture_posture": "Not applicable (no person)",
    "props": [
      "the product object"
    ],
    "wardrobe": null,
    "lighting": "Even, soft studio light",
    "cultural_markers": [],
    "emotional_tone": null,
    "composition": "Centred object, clean background",
    "exclusions": [
      "no symmetrical AI-face",
      "no gradient blobs",
      "no clinical staging or staged pain expression",
      "no embedded text or lettering",
      "no fabricated product UI or tools"
    ],
    "detail_classes": {
      "scene": "source_grounded",
      "environment": "source_grounded",
      "subject": "source_grounded",
      "gesture_posture": "source_grounded",
      "props": "source_grounded",
      "lighting": "production_instruction",
      "composition": "production_instruction",
      "exclusions": "source_grounded"
    },
    "provenance": {
      "angle_id": null,
      "customer_truth_refs": [],
      "product_truth_refs": [],
      "brand_truth_version": "1.0",
      "platform": null,
      "asset_purpose": null,
      "derivation": "deterministic:VisualGroundingService@1.0"
    }
  },
  "visual_asset_spec": {
    "id": "VAS-VQ3-001",
    "class": "visual_asset_spec",
    "production_mode": "GENERATED_SCENE",
    "compound": false,
    "aspect_ratio": "1200:1600",
    "canvas": {
      "width": 1200,
      "height": 1600
    },
    "overlay": {
      "type": "none"
    }
  },
  "image_render_spec": {
    "spec_type": "ImageRenderSpec",
    "scene": "The product object presented on a neutral surface",
    "aspect_ratio": "1200:1600",
    "negative_constraints": [
      "no symmetrical AI-face",
      "no gradient blobs",
      "no clinical staging or staged pain expression",
      "no embedded text or lettering",
      "no fabricated product UI or tools"
    ],
    "text_overlay_allowed": false
  },
  "prompt_package": {
    "id": "IPP-VQ3-001",
    "prompt": "Scene: The product object on a neutral studio surface. Even soft light, clean background.",
    "negative_prompt": "no symmetrical AI-face; no gradient blobs; no clinical staging or staged pain expression; no embedded text or lettering; no fabricated product UI or tools",
    "negative_constraints": [
      {
        "text": "no symmetrical AI-face",
        "category": "brand_rule",
        "reason": "brand"
      },
      {
        "text": "no gradient blobs",
        "category": "brand_rule",
        "reason": "brand"
      },
      {
        "text": "no clinical staging or staged pain expression",
        "category": "brand_rule",
        "reason": "brand"
      },
      {
        "text": "no embedded text or lettering",
        "category": "brand_rule",
        "reason": "brand"
      },
      {
        "text": "no fabricated product UI or tools",
        "category": "brand_rule",
        "reason": "brand"
      }
    ]
  },
  "expected": {
    "production_mode": "GENERATED_SCENE",
    "compound": false,
    "aspect_ratio": "1200:1600",
    "canvas": {
      "width": 1200,
      "height": 1600
    },
    "text_safe_zones": [],
    "deterministic_overlays": [],
    "structural_requirements": [
      "single product object",
      "clean neutral background",
      "no fabricated product UI or tools",
      "even lighting"
    ],
    "required_negative_categories": [
      "grounding_exclusion",
      "brand_anti_pattern",
      "brand_rule",
      "platform"
    ],
    "judgment_dimensions": [
      "ANGLE_FIDELITY",
      "CUSTOMER_TRUTH_FIDELITY",
      "PRODUCT_TRUTH_FIDELITY",
      "VISUAL_GROUNDING_FIDELITY",
      "SCENE_FIDELITY",
      "CULTURAL_INTEGRITY",
      "EMOTIONAL_INTEGRITY",
      "BRAND_FIT",
      "INTERCHANGEABILITY",
      "AI_ARTIFACTS",
      "ANATOMICAL_PLAUSIBILITY",
      "COMPOSITION",
      "TEXT_SAFETY",
      "UNSUPPORTED_VISUAL_CLAIM"
    ]
  },
  "truth_references": {
    "angle_id": null,
    "customer_truth_refs": [],
    "product_truth_refs": [],
    "brand_truth_version": "1.0"
  },
  "brand_truth_version": "1.0",
  "deterministic_expected_checks": {
    "canvas_dimensions": "1200x1600",
    "aspect_ratio": "1200:1600",
    "image_slot_role": "BACKGROUND",
    "fit": "cover",
    "overlay_type": "none",
    "text_safe_zones_present": true,
    "locked_copy_required": true
  },
  "qualification_dimensions": [
    "ANGLE_FIDELITY",
    "CUSTOMER_TRUTH_FIDELITY",
    "PRODUCT_TRUTH_FIDELITY",
    "VISUAL_GROUNDING_FIDELITY",
    "SCENE_FIDELITY",
    "CULTURAL_INTEGRITY",
    "EMOTIONAL_INTEGRITY",
    "BRAND_FIT",
    "INTERCHANGEABILITY",
    "AI_ARTIFACTS",
    "ANATOMICAL_PLAUSIBILITY",
    "COMPOSITION",
    "TEXT_SAFETY",
    "PLATFORM_FIT",
    "UNSUPPORTED_VISUAL_CLAIM"
  ],
  "fixture_hash": "8a822d3358bf1e4f0c3fc2091bddb95a8cf35cedf5c07b4cd196d21e739929f1"
}
